Business Name,Category,Area,Neighborhood,Services,Amenities,Price,Rating,Reviews,Website,Phone,Images,Description,Ignored Internal Notes
Central Wellness Studio,Health,Central District,Downtown,"Appointments, Online Enquiries","Accessible Entrance, Customer Support",2,4.8,214,https://example.com/wellness,+44 20 0000 0001,"https://images.unsplash.com/photo-1497366754035-f200968a6e72, https://images.unsplash.com/photo-1497366811353-6870744d04b2","Independent wellness service with appointment-based consultations.",Keep this internal note out of the site
Northside Repair Co,Home Services,North District,Workshop Quarter,"On-site Service, Emergency Callouts","Parking, Card Payments",premium,4.6,88,https://example.com/repair,+44 20 0000 0002,https://images.unsplash.com/photo-1504917595217-d4dc5ebe6122,"Local repair service for homes and small businesses.",Generic service listing
West Market Books,Shopping,West District,Market Street,"In-store Shopping, Pickup","Wi-Fi",cheap,4.4,51,https://example.com/books,+44 20 0000 0003,https://images.unsplash.com/photo-1526243741027-444d633d7365,"Independent retail shop with online enquiries and local pickup.",Generic retail listing
Evening Workspace,Professional Services,Old Town,Station Road,"Wi-Fi, Late Hours, Quiet Space","Power Outlets",medium,4.3,19,https://example.com/workspace,+44 20 0000 0004,https://images.unsplash.com/photo-1497366754035-f200968a6e72,"Laptop-friendly workspace for evening bookings.",Generic workspace listing
,Services,Old Town,Square,"Appointments",Customer Support,1,4.2,10,https://example.com/unnamed,+44 20 0000 0005,https://images.unsplash.com/photo-1521017432531-fbd92d768814,"This row should be skipped because it has no name.",Missing name warning
